{
  "workflow_id": "wf_dba9a88123c2496b8348bb13da6d1966",
  "name": "Code Review Workflow",
  "description": "Created from canvas on 2026-01-24",
  "status": "testing",
  "version": "0.1",
  "execution_model": "sequential",
  "agents": [
    "agt_5e3e95a63d334abf9680914ca78ff2ad",
    "agt_47c0f7942826497e8aea8d6eb12cd511",
    "agt_3af3091011fd4ffb8f79d5d32dfb9048",
    "agt_61053b34275d4fd69d77224a1aa5ac7d",
    "agt_9c26ea43368040c5ab10c36bef38f396"
  ],
  "connections": [
    {
      "from": "agt_5e3e95a63d334abf9680914ca78ff2ad",
      "to": "agt_47c0f7942826497e8aea8d6eb12cd511"
    },
    {
      "from": "agt_47c0f7942826497e8aea8d6eb12cd511",
      "to": "agt_3af3091011fd4ffb8f79d5d32dfb9048"
    },
    {
      "from": "agt_3af3091011fd4ffb8f79d5d32dfb9048",
      "to": "agt_61053b34275d4fd69d77224a1aa5ac7d"
    },
    {
      "from": "agt_61053b34275d4fd69d77224a1aa5ac7d",
      "to": "agt_9c26ea43368040c5ab10c36bef38f396"
    }
  ],
  "state_schema": {
    "query": "string",
    "result": "string"
  },
  "metadata": {
    "created_by": "workflow_builder",
    "created_at": "2026-01-24T19:32:40.532677",
    "canvas_layout": {
      "width": 5000,
      "height": 5000
    },
    "is_temp": true
  }
}