{
  "workflow_id": "wf_04c515702f0a49cea3e805fab4b34ef7",
  "name": "Code Execution and Optimization",
  "description": "Created from canvas on 2026-01-21",
  "status": "draft",
  "version": "0.1",
  "execution_model": "sequential",
  "agents": [
    "agt_1765001cc63f4afd847615f1945d6a33",
    "agt_5eedc80f1dd940d5b175867771e32081",
    "agt_b935e56469464b7bacf02c74bcdc48be",
    "agt_31a6ad43567f40ea86d3b56b45f25a46",
    "agt_aa1f334bdc1e41a285b1ce2842a100b1",
    "agt_9235091378954c0eb91d016b2d3347eb"
  ],
  "connections": [
    {
      "from": "agt_1765001cc63f4afd847615f1945d6a33",
      "to": "agt_5eedc80f1dd940d5b175867771e32081"
    },
    {
      "from": "agt_5eedc80f1dd940d5b175867771e32081",
      "to": "agt_b935e56469464b7bacf02c74bcdc48be"
    },
    {
      "from": "agt_b935e56469464b7bacf02c74bcdc48be",
      "to": "agt_31a6ad43567f40ea86d3b56b45f25a46"
    },
    {
      "from": "agt_31a6ad43567f40ea86d3b56b45f25a46",
      "to": "agt_aa1f334bdc1e41a285b1ce2842a100b1"
    },
    {
      "from": "agt_aa1f334bdc1e41a285b1ce2842a100b1",
      "to": "agt_9235091378954c0eb91d016b2d3347eb"
    }
  ],
  "state_schema": {
    "query": "string",
    "result": "string"
  },
  "metadata": {
    "created_by": "workflow_builder",
    "created_at": "2026-01-21T03:31:33.545625",
    "canvas_layout": {
      "width": 5000,
      "height": 5000
    }
  }
}