{
  "workflow_id": "wf_fc1fe72dacfc4f52b7a0ba11d798987d",
  "name": "Code Generation Workflow",
  "description": "Created from canvas on 2026-01-23",
  "status": "draft",
  "version": "0.1",
  "execution_model": "sequential",
  "agents": [
    "agt_bd9398f9497b46e5853ebb0eaf211651",
    "agt_b2ad1549fd09492a8e5307f02d901c38",
    "agt_7c53ea1b26994e42a5d0a6b1dd139eab",
    "agt_5080b90779a44bbf9534ba92331d4c4f",
    "agt_8b56d82ed27144b2adef100acfa7c0f7"
  ],
  "connections": [
    {
      "from": "agt_bd9398f9497b46e5853ebb0eaf211651",
      "to": "agt_b2ad1549fd09492a8e5307f02d901c38"
    },
    {
      "from": "agt_b2ad1549fd09492a8e5307f02d901c38",
      "to": "agt_7c53ea1b26994e42a5d0a6b1dd139eab"
    },
    {
      "from": "agt_7c53ea1b26994e42a5d0a6b1dd139eab",
      "to": "agt_5080b90779a44bbf9534ba92331d4c4f"
    },
    {
      "from": "agt_5080b90779a44bbf9534ba92331d4c4f",
      "to": "agt_8b56d82ed27144b2adef100acfa7c0f7"
    }
  ],
  "state_schema": {
    "query": "string",
    "result": "string"
  },
  "metadata": {
    "created_by": "workflow_builder",
    "created_at": "2026-01-23T19:20:38.980587",
    "canvas_layout": {
      "width": 5000,
      "height": 5000
    }
  }
}