{
  "workflow_id": "wf_95220dac8629475ca42115e8b63c016a",
  "name": "Code Review Workflow",
  "description": "Created from canvas on 2026-01-25",
  "status": "draft",
  "version": "0.1",
  "execution_model": "hybrid",
  "agents": [
    "agt_320c22ab194146df997cec87ca9a4e5d",
    "agt_40e02f7588554671939fa72cdf5d863e",
    "agt_a06015830c024c86bc01c904c35a60c2",
    "agt_5e4825c8d2384d9eb7d90af4f09f4212",
    "agt_c272e57d7ee84f1aa88518f070e4cc84",
    "agt_f12f180ba2004ecca4f3c5c9400d0c46",
    "agt_3e90ac1212e8424e88e9213e6be8aff3",
    "agt_edcd86c66ae540e7a2ec5035928cc456"
  ],
  "connections": [
    {
      "from": "agt_320c22ab194146df997cec87ca9a4e5d",
      "to": "agt_40e02f7588554671939fa72cdf5d863e"
    },
    {
      "from": "agt_40e02f7588554671939fa72cdf5d863e",
      "to": "agt_a06015830c024c86bc01c904c35a60c2"
    },
    {
      "from": "agt_a06015830c024c86bc01c904c35a60c2",
      "to": "agt_5e4825c8d2384d9eb7d90af4f09f4212"
    },
    {
      "from": "agt_5e4825c8d2384d9eb7d90af4f09f4212",
      "to": "agt_c272e57d7ee84f1aa88518f070e4cc84"
    },
    {
      "from": "agt_c272e57d7ee84f1aa88518f070e4cc84",
      "to": "agt_f12f180ba2004ecca4f3c5c9400d0c46"
    },
    {
      "from": "agt_f12f180ba2004ecca4f3c5c9400d0c46",
      "to": "agt_3e90ac1212e8424e88e9213e6be8aff3"
    },
    {
      "from": "agt_3e90ac1212e8424e88e9213e6be8aff3",
      "to": "agt_edcd86c66ae540e7a2ec5035928cc456"
    }
  ],
  "state_schema": {
    "query": "string",
    "result": "string"
  },
  "metadata": {
    "created_by": "workflow_builder",
    "created_at": "2026-01-25T14:30:12.975013",
    "canvas_layout": {
      "width": 5000,
      "height": 5000
    }
  }
}