{
  "workflow_id": "wf_3e56438728cf47409e8911e3014bb6ab",
  "name": "Code Generation Workflow",
  "description": "Created from canvas on 2026-01-23",
  "status": "testing",
  "version": "0.1",
  "execution_model": "sequential",
  "agents": [
    "agt_fb2d950219fc49deaabf2990f787c0ca",
    "agt_4e160b35a8704c02a8c4dcb63f8c3556",
    "agt_8ef508603ab843d38245b974b600801b",
    "agt_66f0e2e0215a4214b5310f439d32c497",
    "agt_6658003208f2458f92e151f8eeb89ddd"
  ],
  "connections": [
    {
      "from": "agt_fb2d950219fc49deaabf2990f787c0ca",
      "to": "agt_4e160b35a8704c02a8c4dcb63f8c3556"
    },
    {
      "from": "agt_4e160b35a8704c02a8c4dcb63f8c3556",
      "to": "agt_8ef508603ab843d38245b974b600801b"
    },
    {
      "from": "agt_8ef508603ab843d38245b974b600801b",
      "to": "agt_66f0e2e0215a4214b5310f439d32c497"
    },
    {
      "from": "agt_66f0e2e0215a4214b5310f439d32c497",
      "to": "agt_6658003208f2458f92e151f8eeb89ddd"
    }
  ],
  "state_schema": {
    "query": "string",
    "result": "string"
  },
  "metadata": {
    "created_by": "workflow_builder",
    "created_at": "2026-01-23T19:20:42.030873",
    "canvas_layout": {
      "width": 5000,
      "height": 5000
    },
    "is_temp": true
  }
}