{
  "workflow_id": "wf_3f397c4c93dd4488ab3d9c3142b7025c",
  "name": "Python Code Generation Workflow",
  "description": "Created from canvas on 2026-01-23",
  "status": "testing",
  "version": "0.1",
  "execution_model": "sequential",
  "agents": [
    "agt_f2c4b60196bd407f97578b130d92c8cd",
    "agt_7d4bca39d51b446db7e4a002785974ee",
    "agt_4f40dfa1f8724ed3b668cabb41142219",
    "agt_f4b77768402548868db56552b43dca41",
    "agt_d22460d2e1b1439fa7f1a61b2191d2e7"
  ],
  "connections": [
    {
      "from": "agt_f2c4b60196bd407f97578b130d92c8cd",
      "to": "agt_7d4bca39d51b446db7e4a002785974ee"
    },
    {
      "from": "agt_7d4bca39d51b446db7e4a002785974ee",
      "to": "agt_4f40dfa1f8724ed3b668cabb41142219"
    },
    {
      "from": "agt_4f40dfa1f8724ed3b668cabb41142219",
      "to": "agt_f4b77768402548868db56552b43dca41"
    },
    {
      "from": "agt_f4b77768402548868db56552b43dca41",
      "to": "agt_d22460d2e1b1439fa7f1a61b2191d2e7"
    }
  ],
  "state_schema": {
    "query": "string",
    "result": "string"
  },
  "metadata": {
    "created_by": "workflow_builder",
    "created_at": "2026-01-23T18:32:15.617188",
    "canvas_layout": {
      "width": 5000,
      "height": 5000
    },
    "is_temp": true
  }
}