{
  "workflow_id": "wf_1a4335dd05c04111ba22d54f5665913f",
  "name": "Code Review Workflow",
  "description": "Created from canvas on 2026-01-25",
  "status": "testing",
  "version": "0.1",
  "execution_model": "hybrid",
  "agents": [
    "agt_d4f23d5a8f4d4a0dae0575eb7d3587c3",
    "agt_dda0c1841e7845cc87fae0328e905c0a",
    "agt_e31092490df0450aae817ea338c6cb44",
    "agt_913a0b45b87649d3b3c81330b390788f",
    "agt_4c1f563d7109424f9535acd7354a8661",
    "agt_98172b1247ff457796153c4c6747cb7c",
    "agt_f5612a8922ea47d383d8d1cb1f3346be",
    "agt_c9a4f28ab7dc44d2b21ce312be82278d"
  ],
  "connections": [
    {
      "from": "agt_d4f23d5a8f4d4a0dae0575eb7d3587c3",
      "to": "agt_dda0c1841e7845cc87fae0328e905c0a"
    },
    {
      "from": "agt_dda0c1841e7845cc87fae0328e905c0a",
      "to": "agt_e31092490df0450aae817ea338c6cb44"
    },
    {
      "from": "agt_e31092490df0450aae817ea338c6cb44",
      "to": "agt_913a0b45b87649d3b3c81330b390788f"
    },
    {
      "from": "agt_913a0b45b87649d3b3c81330b390788f",
      "to": "agt_4c1f563d7109424f9535acd7354a8661"
    },
    {
      "from": "agt_4c1f563d7109424f9535acd7354a8661",
      "to": "agt_98172b1247ff457796153c4c6747cb7c"
    },
    {
      "from": "agt_98172b1247ff457796153c4c6747cb7c",
      "to": "agt_f5612a8922ea47d383d8d1cb1f3346be"
    },
    {
      "from": "agt_f5612a8922ea47d383d8d1cb1f3346be",
      "to": "agt_c9a4f28ab7dc44d2b21ce312be82278d"
    }
  ],
  "state_schema": {
    "query": "string",
    "result": "string"
  },
  "metadata": {
    "created_by": "workflow_builder",
    "created_at": "2026-01-25T14:28:59.149163",
    "canvas_layout": {
      "width": 5000,
      "height": 5000
    },
    "is_temp": true
  }
}