{
  "workflow_id": "wf_284f128f0f764c5e90597584e22071ab",
  "name": "Code Generation Workflow",
  "description": "Created from canvas on 2026-01-24",
  "status": "draft",
  "version": "0.1",
  "execution_model": "sequential",
  "agents": [
    "agt_676834f2350a40b991338b9c00a042ea",
    "agt_884c553a8c3844a68d281ed314ab3006",
    "agt_17d32ed83c5e49b58bb0716c4d0683e5",
    "agt_8b8b398544b844438ee764414754957d",
    "agt_911dde7d2e9f44e08745020c3aaaec3a"
  ],
  "connections": [
    {
      "from": "agt_676834f2350a40b991338b9c00a042ea",
      "to": "agt_884c553a8c3844a68d281ed314ab3006"
    },
    {
      "from": "agt_884c553a8c3844a68d281ed314ab3006",
      "to": "agt_17d32ed83c5e49b58bb0716c4d0683e5"
    },
    {
      "from": "agt_17d32ed83c5e49b58bb0716c4d0683e5",
      "to": "agt_8b8b398544b844438ee764414754957d"
    },
    {
      "from": "agt_8b8b398544b844438ee764414754957d",
      "to": "agt_911dde7d2e9f44e08745020c3aaaec3a"
    }
  ],
  "state_schema": {
    "query": "string",
    "result": "string"
  },
  "metadata": {
    "created_by": "workflow_builder",
    "created_at": "2026-01-24T05:58:17.202669",
    "canvas_layout": {
      "width": 5000,
      "height": 5000
    }
  }
}