{
  "workflow_id": "wf_3f58573d3ac14f079188496543be7f66",
  "name": "API Review Workflow",
  "description": "Created from canvas on 2026-01-23",
  "status": "testing",
  "version": "0.1",
  "execution_model": "sequential",
  "agents": [
    "agt_54c70adddaa94fcb9be7a754814e94c3",
    "agt_c87c2532ea964977b605cf1e13a8fa51",
    "agt_6691340e157d4db59cd0c71708a2d613",
    "agt_7b21d6da45b14e7dabca4def499db4e6",
    "agt_3cb8145e0942422490802534c880ab9e"
  ],
  "connections": [
    {
      "from": "agt_54c70adddaa94fcb9be7a754814e94c3",
      "to": "agt_c87c2532ea964977b605cf1e13a8fa51"
    },
    {
      "from": "agt_c87c2532ea964977b605cf1e13a8fa51",
      "to": "agt_6691340e157d4db59cd0c71708a2d613"
    },
    {
      "from": "agt_6691340e157d4db59cd0c71708a2d613",
      "to": "agt_7b21d6da45b14e7dabca4def499db4e6"
    },
    {
      "from": "agt_7b21d6da45b14e7dabca4def499db4e6",
      "to": "agt_3cb8145e0942422490802534c880ab9e"
    }
  ],
  "state_schema": {
    "query": "string",
    "result": "string"
  },
  "metadata": {
    "created_by": "workflow_builder",
    "created_at": "2026-01-23T21:47:03.880850",
    "canvas_layout": {
      "width": 5000,
      "height": 5000
    },
    "is_temp": true
  }
}