{
  "workflow_id": "wf_f168fa82eaa445098a481b2ef4a46b66",
  "name": "PythonCodeGeneratorWorkflow",
  "description": "Created from canvas on 2026-01-23",
  "status": "draft",
  "version": "0.1",
  "execution_model": "sequential",
  "agents": [
    "agt_22af656c88104fe3b7407ca1f48894c7",
    "agt_06e103ac8ace40fe97e58f00f95fc0f9",
    "agt_83f20b0268ed4771befdfbea7d9ca184",
    "agt_fa08379048854be9a94e6b74d11364f5",
    "agt_d6a768cd6e144a9997b4223780ad51dd"
  ],
  "connections": [
    {
      "from": "agt_22af656c88104fe3b7407ca1f48894c7",
      "to": "agt_06e103ac8ace40fe97e58f00f95fc0f9"
    },
    {
      "from": "agt_06e103ac8ace40fe97e58f00f95fc0f9",
      "to": "agt_83f20b0268ed4771befdfbea7d9ca184"
    },
    {
      "from": "agt_83f20b0268ed4771befdfbea7d9ca184",
      "to": "agt_fa08379048854be9a94e6b74d11364f5"
    },
    {
      "from": "agt_fa08379048854be9a94e6b74d11364f5",
      "to": "agt_d6a768cd6e144a9997b4223780ad51dd"
    }
  ],
  "state_schema": {
    "query": "string",
    "result": "string"
  },
  "metadata": {
    "created_by": "workflow_builder",
    "created_at": "2026-01-23T18:45:44.379450",
    "canvas_layout": {
      "width": 5000,
      "height": 5000
    }
  }
}