{
  "workflow_id": "wf_34f75a236bc749b8aca5baa273891ba6",
  "name": "Code Review Workflow",
  "description": "Created from canvas on 2026-01-25",
  "status": "testing",
  "version": "0.1",
  "execution_model": "hybrid",
  "agents": [
    "agt_13368eef871d41a2b71931d1edcefe76",
    "agt_de740a116a204279be1dea619d409ca4",
    "agt_0de9a182d4614bdb97dd6c386322986e",
    "agt_b4d1f65125404f4ebc2a620532070829",
    "agt_87b76f41a7594945822722b7f3354646",
    "agt_f0845e486f4243139e8487f1d34e10ef",
    "agt_8981285d14b74a12b489b0e31f87cc92"
  ],
  "connections": [
    {
      "from": "agt_13368eef871d41a2b71931d1edcefe76",
      "to": "agt_de740a116a204279be1dea619d409ca4"
    },
    {
      "from": "agt_de740a116a204279be1dea619d409ca4",
      "to": "agt_0de9a182d4614bdb97dd6c386322986e"
    },
    {
      "from": "agt_0de9a182d4614bdb97dd6c386322986e",
      "to": "agt_b4d1f65125404f4ebc2a620532070829"
    },
    {
      "from": "agt_b4d1f65125404f4ebc2a620532070829",
      "to": "agt_87b76f41a7594945822722b7f3354646"
    },
    {
      "from": "agt_87b76f41a7594945822722b7f3354646",
      "to": "agt_f0845e486f4243139e8487f1d34e10ef"
    },
    {
      "from": "agt_f0845e486f4243139e8487f1d34e10ef",
      "to": "agt_8981285d14b74a12b489b0e31f87cc92"
    }
  ],
  "state_schema": {
    "query": "string",
    "result": "string"
  },
  "metadata": {
    "created_by": "workflow_builder",
    "created_at": "2026-01-25T15:08:48.259479",
    "canvas_layout": {
      "width": 5000,
      "height": 5000
    },
    "is_temp": true
  }
}