{
  "workflow_id": "wf_745296aa645b4012a211773c08cb9ed9",
  "name": "Code Execution and Review Workflow",
  "description": "Created from canvas on 2026-01-27",
  "status": "testing",
  "version": "0.1",
  "execution_model": "sequential",
  "agents": [
    "agt_5042be3ec53c46b288f76589bb5ac561",
    "agt_f460973b61d24b26b48be35033f820cb",
    "agt_191c6b680d3146bab49be187a7133e47",
    "agt_b3c6c4cc8fc94326906c92813cabffe6"
  ],
  "connections": [
    {
      "from": "agt_5042be3ec53c46b288f76589bb5ac561",
      "to": "agt_f460973b61d24b26b48be35033f820cb"
    },
    {
      "from": "agt_f460973b61d24b26b48be35033f820cb",
      "to": "agt_191c6b680d3146bab49be187a7133e47"
    },
    {
      "from": "agt_191c6b680d3146bab49be187a7133e47",
      "to": "agt_b3c6c4cc8fc94326906c92813cabffe6"
    }
  ],
  "state_schema": {
    "query": "string",
    "result": "string"
  },
  "metadata": {
    "created_by": "workflow_builder",
    "created_at": "2026-01-27T09:35:30.413017",
    "canvas_layout": {
      "width": 5000,
      "height": 5000
    },
    "is_temp": true
  }
}